tweet,label
♫aga m eburu halleluyah eburu aga m apara halleluyah apara pagara eze jesus onye oma♫,1
allah ya dai jiqan mu a wanan country din,0
idan baku da abin cewa kusa hoton minister saadiya muyi mata addua,0
my friend dey this table sef,2
allah yasa hakane yafi masa alkairi,0
anam ekele gi onum juru nekele,1
nke chi nyere m oooo ka mma,1
amin ko si oun to soro fun eledua,3
legendary hustler wedding work na the work wey we dey do let me handle your event be,2
josie ike nwa nna,1
tabbas munyi arasa rashin dan wasa mai barkwance allah yasa ka huta yasa aljanna ce makoma ameen,0
lahaula walakauwata illabillahil azim allah yakawo man karshe wannan masiba a duniya baki daya dan darajar annabi,0
arin no go send anybody this week she don dey sleep early now self wahala be like nominations,2
lord am saying nma nma nma jesus onye ebere,1
ní báyìí ẹ̀yin èèyàn rere ẹ jẹ́ ká máa bá ìtàn ògún lọ ẹ káàsán o,3
ilu ibadan ni ipinle oyo orilede nijiria mo feran ilu ibadan pupo ilu awa akoni,3
how far na make una help me post my ownnnnn or tell me how i go take waka am na be o,2
make una nor go sell una vote o vote pdp,2
amen edumare be e lo ma ri fun wa,3
e kú òwúrò o èyin ènìyan wa a kú ìpalèmó òpin òsè,3
ai zaman lafia kenan mutai makawa yar uwarmu,0
good morning akpors baba greetings to the upcoming dj there i know say na upper iweka dey use dat guy abeg morning to all my people especially evangeline obiora,2
e dey don start,2
akramakallah namba ai wing ne allah ya ƙara wa mallam basira tsawon rai lafiya da rayuwa mai albarka,0
fatan alkhairin allah agareki ubangiji allah ya tsareki sharrin mutum da aljan,0
ewé ìtàkùn èso tí tí kan èpo ẹ̀hìn igi ni ó níṣẹ́ ìwòsàn tí í ṣe láàgọ́ ara wa àtẹ̀pà àpatán ráúráú ni àgbo ń pa àìsàn tòun aàrùn,3
i don get power bank mah na the watch de remain who go buy watch for me,2
na tou dey reign by with benjamin ekezie,2
lahira ma free ake zuwa ai,0
which club dem go spray money this weekend make una still carry me go na i no dey shame to pick oo,2
happy birthday eze ụmụ agbọghọ na awka nile olisa dube gị,1
ezigbo nwanyi nnewi,1
innalillahi wainna ilayhi rajiun allah yataimake wannan matar dan darajar annabi muhammadu sallallahu alayhi wasallam,0
a kú oṣù tuntun ooo a sàn wá sówó sọ́mọ́ àti àìkú baálẹ̀ ọ̀rọ̀,3
mudai allah yabamu mafi alheri,0
muna tayashi murna d fatan zaiyi koyi d nagartattun shuwagabannin rundunar sojan kasa da suka gabata allah kajikan laftal janar i attahir,0
e kaaro ojo jimoh yi a dun fun gbogbo wa ire at ayo kong ni tan laaye wa amin,3
ekaaaro oh a ku jimoh oloyin edumare a fi melody saye wa oh rt ọjọ́ ẹtì dé o ọjọ́ ayọ̀ ọjọ́ mìlíkì,3
oṣó yí mi ká,3
swipe tort square plastic sunglasses with green lens price n̶ ️ color blue size m dm to order shakarashop online shop wen sabi you sef go dey do shakara warri nigeria,2
allah yah ya kyauta,0
emi ti ṣetán oo toò ta ló ṣetán láti ṣàtìlẹ́hìn fún àwọn agbábọ́ọ̀lù wa ní,3
yau dai ana baka kuluwaa,0
ọ bọrọ chi kene chi ya makana chukwu ebuka onye mere ka ndụ fọdụrụ mụ na ụmụnne m nara ekele nara otiti ma narakwa nburi elu,1
nítorí yíyẹ ní í yẹyẹlé dandan ni yóò yẹ mí kalẹ́ kára ó rọ̀ mí dẹ̀dẹ̀ ṣẹ̀ṣẹ̀ bí ó ṣe rọ àdàbà lọ́rùn,3
ẹ̀yin ogun ọ̀run ò ẹ ṣéun o,3
e dey always dey two we can share,2
nwa ọma unique astec,1
wannan shine nasir salisu zango wlhi ban taba ganin shi bah ko a hoto sai yau wayyo dadi kashe ni,0
allh bar zumunci,0
allah kakawo mana karshen zubarda jinnin musulmea afadin duniya,0
kábíèsí ọba ògo jọ̀wọ́ wá tamí lọ́re owó ọmọ àlááfíà àti àìkú baálẹ̀ ọrọ̀ káyé mi ó dára bo bá gbàgbọ́ pé á ṣẹ,3
ok then no wahala udo,1
e don dey set come small small day today,2
nwata di nma w on tune in,1
na so una accept bu make hin dey go abeg,2
rabbana atina fiddunya hasanah wa fil akhirati hasanah wa qinaa azabannaar jumaat mubarak,0
allah ya kaimu sati biyu ba fushi muke ba,0
alhamdulillah wlh nafi jin kowa dadi because dama sometimes sabo sukeyi,0
e even blow powder join am sef,2
alhamdullah allah yakara karemu,0
ayya kash sai dai bani kusa da wajen bikin kai ga wayatana biyo taciki because i dont want to be left behind allah sanya alkairi,0
okrika wey pass okrika na me be this check out the quality and design correct top lime this you fit wear go anywhere oya follow the process below️️️️ slay on budget shop,2
ẹ ye pa oníròhìn iṣẹ wọn lọ ń ṣe,3
ìfura lòògùn àgbà translation suspicion is the charm of the elderly,3
ogaranya amaka mma na okorobia no go tiff oh,1
allah dai ya kawo na badi mai albarka,0
ife dị mma ga abịa lu anyị taa ta ná jesus christ bụ dị nwenụ anyị amen,1
ògbójú olóògùn tó mọ ojú ìgbín nínú ìkarahun nípa ewé àtegbò ni oṣóòsì pẹjapẹja ní í ṣe pẹ̀lú,3
ekwueme onye nwe anyi ezitewo ndi mmoziya ka ha nonyere anyi you are the living god o eze no,1
stay strong nwanyị ọma ogadimma,1
kí a máa pa àrọwà fún ọmọdé ká ṣe àlàyé baba ọ̀rọ̀ ohunkóhun tó bá rú wọn lójú fún wọn,3
de only pipo sorry lovers dat can insult me on dis twitter n go free i love you,2
i look at some of the dresses i made and im like damn i sabi dis tailor work for real,2
pls kada ka haddasa bakin ciki a zuciyar dan naga taketakenka kenan but any way allah ya karawa rayuwa albarka da basira,0
you sabi proper picture dey come representing,2
loyal to my childhood brands you cant catch me buy or drink pepsi or their products my mum was a distributor of coke products when i dey small na bournvita i still dey buy with peak milk e dey hard me to change my brands anyway na city be my second tram this season,2
ojoojo o ni sowo ko ma le naja owo ire omo ati aiku baale oro yoo je ti gbogbo wa lagbara olohun,3
but u na boss na make i send you my aza,2
and his fathers briefcase with k note full inside dat guy been de off me i swear,2
wibe eledua de fi ase si ofi idi remi ninu idije asofin,3
gwamnan borno karike gaskiya allah zai tsareka daga sharin dan adam albarka annabi da alqurani,0
ekele dịrị ónyé mèrè ka anyị dị ndụ ná àlà ndị dị ndụ ónyé mèrè ka anyị hụ ụbọchị nke tà ekele dịrị ónyé nwé anyị na áhà jizọs kraịst bú onye anyị amén,1
oore lópé ìkà ò sunwọ̀n its kindness that pays wickedness is not laudable,3
nani jehovah bu onye m nwere nani jehovah bu onye m nwere ♫♫,1
ẹ ti gbìyànjú ẹ tún bọ̀ ṣe díẹ̀ si kí ẹ fi parí rẹ̀,3
allah ya gafarta mata yasa ya huta tareda iyayenmu dasuka rigamu,0
so we plenty wey dey wear glassesnice,2
damn rukayya na bada allah yah kara basira director,0
àsìkò ni gbogbo nǹkan àsìkò eré ọ̀tọ̀ àsìkò iṣẹ́ ọ̀tọ̀ ọpọlọ ò sinmi iṣẹ́ ló ń ṣe àfi kí olódùmarè ó sọ iṣẹ́ ọwọ́ wa di owó,3
nwoke oma omalicha nwa obiwon voice,1
be ni o baba opelope awon obi wa,3
penissilin na pain reliever na,2
odogwu lawyer nsogbu adi ro,1
beeni amin ase lagbara edumare emi o gboju mi soke ayo nbo lola mo si ma sooriire,3
allah ubangiji ya kawo mana zaman lafiya mai dorewa akasarmu nigeria ameen,0
abeg wetin dey happen here ooo better content everywhere someone tag me to a gist for starts biko,2
aunty anfada soyayya allah ya kaimu musha biki,0
jesu nikan larin ohun gbogbo,3
ifugo okwu a chukwu gozie gi nwanne,1
ọkwu gị kwụ ọtọ kà cigarette,1
allah yakawo mana daukin wannar annoba guda ta covid ta cuta data covid ta yunwa,0
wannan kyau haka kaman ba za a mutu ba beautiful is your name,0
happy birthday eze di igbo obi of ontisha hrm nnaemeka alfred achebe,1
kò tọ́pẹ́ o a kìí dúpẹ́ ara ẹni,3
ahhhhhhhh ewo aworan zahra omo ogagun ta ni ori iru omo ti o dun ti o lewa ti ko ni dibo fun baba re,3
allah yakawo mana karshen wannan tashin hankali,0
♬agama turu gi mma mma mma mma eh♬,1
ògúnbánjọ ògún is in agreement with me,3
wannan abu yayi muna goyan baya,0
sai maigida allah ya karama daukaka,0
odowara agu onu,1
gskyn hajiya enjoy,0
if na lion teeth the money they na to carry dentist follow body,2
no use laugh kill pesin abeg,2
be like my belle don dey big osmall enjoyment,2
ìtanijí gìrì ni èyí ọ̀gá ṣá ti lọ ó yẹ kí a já ara wa kí a padà sí ẹsẹ̀ àárọ̀,3
if na like this dates dey be ah we all should be hanging out more na,2
hmmmmmmm hau ka tafi oga labarina yana tafiya yanda akeso wannan ka rabu dashi son a san yayi sug president neh kurum amma labarina yana yanda ake so,0
amin ase àṣẹ wáà wáà ní tìrèké àṣẹ adùn ni toyin ireákárí,3
allah ya kara daukakayou shall soar higher,0
ìwà rere lẹ̀ṣọ́ ènìyàn good character is what adorns a man good character beautifies,3
mbaise nwere mmadu right here denne osuagwu ekele oo,1
tó arọ̀ á rọ̀ mọ,3
chere ka chukwu gozie m next year aga m akpo gi ocassion,1
jisie ike nwoke ibe m,1
presido abeg na im not feeling fine,2
vote nengi to chukwu gozie gi,1
ooré níwọ̀n àánú lérè,3
somethin about the coyness of ozo and nengis relationship and interaction that ive come to deeply like its not common anymore cos everybody wan show say dem tear eye dont know when and how it happened but i think im now an ozone shipper god help me ‍️,2
ẹni bá dákẹ́ tara rẹ̀ á ba dákẹ́ translation a closed mouth is a closed destiny,3
u don finish work abeg let dem,2
ó dára bẹ́ẹ̀ o ọ̀rẹ́ nígbà wo ni ká bẹ̀rẹ̀,3
bros i dey your back but na bolle and sauce i fit chop as we dey slaughter them with tweets,2
ẹ kú ìtọ́jú máa kọrin arẹmọlẹ́kùn fún adérìnsọ́lá kí o máa gbé e jó kí wọ́n fẹ́rànan rẹ̀,3
ameen besty na godiya,0
ekwu eme =jesus,1
omo na blessings on blessings way me i dey find,2
she no go disturb you just dey your lane if you dey ninja let me know make i flex you i like your way meh im just trying to make a joke nothing attached follow back,2
the most popular hausa man in the world i dey salute oga kawai ka fito takarar shugaban kasa kaga kai ke da arewa,0
àgbájọ ọwọ́ ni a fi ń sọ àyà bẹ́ẹ̀ sì ni àjòjì ọwọ́ kan kò gbé ẹrù lé orí bí èmi àti ìwọ bá jọ ṣe é ohun gbogbo á yanjú mọ̀nà,3
na person wey know u u sef fit no know goal might differ but the smooth talk tactics is same,2
allah subhanahu wataàla yajikansu yakuma gafartamusumukuma allah yakyautata karshenmu ya rabbalalameen,0
eze umu nwayi,1
ramu wannan dogon karan hancin naki har zai karye ai looking stunning tho,0
kèrègbè tó fọ́ dẹ̀yìn lẹ́yìn odò orí burúkú dẹ̀yìn lẹ́yìn mi òfò àti ọ̀fọ̀ ajogun gbogbo dẹ̀yìn lẹ́yìn mi dẹ̀yìn ojúmọ́ ire o,3
bi oluwa ti mbe laiye ni osu september yi akoko ayo ki yio dekun ninu ile yin bi esu fe bi o ko nitori ti yin a oluwa a yi ase tabi majemu itiju pada si ase ati majemu ijo ati ayo loruko jesu eku osu titun ati ojo isinmi kini ninu osu september oti dara fun yin amin,3
masha allahu fa dakyau,0
the eulogy of ìyẹ̀rú ọ̀kín of ọ̀ffà clan delivered in a rhythmic style for the indigenes of ọ̀ffà oríkì ìyẹ̀rú ọ̀kín ti ìlú ọ̀ffà ní a mú wá fún àwọn ọmọ ọ̀ffà pẹ̀lú ohùn aládùn by láti ọwọ́,3
onye isi ekene m gi merry christmas,1
masha allah wannan aikin naso wallahi yayi kyau allah ya kare mana so,0
wannan mai rigan sanyin duk tafisu iya mirror selfie ita waccan mai jikin kamar yau tafara yin mirror selfie amman fa tanada kyau wannan mai yellow din kayan kuma da wayanta aka dauka pics din kunyi kyau,0
true sha na so hazard de like play wan enter through defender,2
jehova bu eze onwero onye furu kam di ga ekweta na mu ejiro shishi chineke biko mee ebere ka ego m di ka m di,1
ẹ̀yin ọ̀dọ́ ẹ̀kọ́ ìwé dáa ṣùgbọ́n á wúlò bí a bá kọ́ṣẹ́ ọwọ́ kan mọ́ ìwé tí a kà,3
every morning i wake up ehhh i always thank god dat i failed dat one maths dat made them move me to art class me nd art was a match made in heaven oo,2
anzo gidanku anyi draw amma you guys are celebrating hala madrid,0
ẹ jẹ́ ká ṣe ara wa ní òṣùṣù ọwọ̀ lets unite like the broomsticks ọwọ̀ ni a fi ń gbá ilẹ̀ ni a tún fi ń pè é ní ìgbál,3
style dinnan yayi,0
mercccyyyy iwu nwa azuru azu nne gi mushiri gi ama am proud of you and i love you,1
allah ya kawo mana karshen koh ameen ya rabbil kuwati wal jabarud,0
men na eti otiti chukwu gozie unu uwa di nma ka afia zuwa abeg,1
chineke nke igwe onye di ka gi ♫♫,1
allah yajikanshi da rahama yasa aljance makoma ameen,0
how una dey enjoy warrii believe say una don grab enuf waffi slangs when com sooner than u knw,2
káàárọ̀ o mà á fẹ́ kí o ya obìnrin tí ó ń gún iyán tí ò wọṣọ kò róṣọ mọ́ àyá àmọ́ ó ró ìró mọ́ ìdí,3
na my own hustle be this and i dey proud say na film i dey shoot,2
ịhụnanya chineke kari si a sorom to chukwu mgbe nile mkpọkworo gị i na za ma e le la anya na zu ime mba mo ka mkpọkworo gị ọkwa i zara mooo onye dị ka gi ooo chineke,1
amen barka da shan ruwa dear rahama,0
allah ya kwace mu,0
my own different i dey post my account balance steady namake una epp me abeg lol,2
ẹlẹ́gbáraẹlẹ́gbáa ️ èlègbàrà èṣù ️ ẹ̀ṣù yà mìíìn èṣù is not satan,3
kó yẹ ká máa ṣààta ẹnikẹ́ni bí a ṣe dá táyé la dá kẹ́hìndè bí a ṣe bí ẹrú la bí ọmọ,3
the number dey dia call me also you too fit believe,2
inside all if i get k e do me,2
bójú bá farabalè á rímú,3
umu oma chai kelerem nwanyi gi,1
yinni yinni kó lè ṣe òmíràn àwòrán yìí rẹwà púpọ̀ ó wú ni lórí a very beautiful and imaginative work,3
da so samu ne kice duk duniya ni kikoso,0
nikam burina shine na samu rayuwa mai albarka dan rayuwa mai albarka ya hada auren mota gida makkah kai hadda madina ma da sauran kayan more rayuwa duk wanda ya yadda da wannan maganan yayi retweeting,0
ni dake mun dace,0
its tha w in the mix nowplaying || wetin dey,2
when it comes to the stomach im so concerned for your partyevents home made food na me dey run am please patronize me here in ikorodu lagos you can check please rt,2
ayafi ki olodumare gba wa,3
barka da sallah rahama sadaumay the almighty god continue blessed youamin summer amin,0
èmi n gbàdúrà pé iṣẹ́ tí mo n ṣe àti iran mi nípa iṣẹ́ mi lọjọ́ iwájú gbooro sí mo n gbàdúrà fáwọn tẹb,3
happy birthday ka chukwunna nke bi nigwe gozie gi mmaji puru mmaji naha jisus kraist bu onye nwe anyi amin,1
garinmu garin dadi wasu ma suyi zaman lafiya ne yakawo,0
food don ready im on my way home oo you dey here dey tweet,2
agbára ọlọ́run ọba mi nùu bí ó ti ń ṣọyẹ́ níbìkan ní ń ṣooru níbòmíì aseyi to,3
i di egwu,1
high chief eze ngwọri nwanne ji kà iji,1
innalillahi waina rajiu ya allah kana ganin irin halin da muke ciki ya allah kawo mana sauki da rangomi ku kuma shugaban nin mu kusani allah ne ya baku milki kuma a lokacin da yake so ya karbi milk sa babu makawa sai ya karba kuma wllh zaku hade da allah dole kuyi bayani,0
kò sẹ́ni tó dàbi i rẹ̀ láyé àti ọ̀runọba alágbára tí ndarí oun gbogboẹ̀rùjẹ̀jẹ̀ létí òkun pupaadagba,3
mo ti já ewé àìkúsàgbàdèwe sọ́wọ́ ọ̀tún mo já ewé ẹ̀yọ̀ṣẹ̀ṣẹ̀ sọ́wọ́ àlàáfíà ikú á yọ̀ mọ́ mi kò ní pa mí lára,3
lately youve been all up in my head playlist ina kpaka mi shi oh omo this jam don de burst my brain ft lately,2
ẹ mà kú ọjọ́ mẹ́ta o,3
marigayi alhaji umaru musa yar adua allah yayi masa rahama,0
wayyo dadi kasheni,0
got these new shoes and i was calling them canvas and said uyi stop calling it canvas na kicks abeg omo na canvas my mama raise me with oh,2
na you dey get person weh deh come from ilorin most times na,2
subhanallah allah ya tsayar haka,0
inúù mi dùn sí kábíyèsí ayọ̀ sì kún inú mi nítorípé baba mọ rìrì àṣà wọn ò ní àwọn ń kírun kí àwọn wọ́ àṣà nílẹ̀,3
abobithe picture too fine you don put am everywhere and na wetin i been plan post on your birthday,2
hmm allah sarki duniya ka kara haure allah yana nan wallahi,0
bẹ́ẹ̀ni ọmọ yorùbá ni mí tọkàntọkàn ọ̀ṣun nilé ìkìrun àgùnbẹ́ onílẹ̀ obì la gbé wò mí dàgbà,3
onye ukwu ka ibu ihe ukwu ka eji mara gi chim oo god is so wonderful,1
even if na tiger mouth the money dey i go carry dentist follow body,2
nee ji sie ike i ga na agbali naeje mimic ihe obula onye igbo obula no gi nap na ekwu na agukwa akwukwo igbo ma o bu ahiriokwu sentence e dere na igbo na agbaso ufodu ndi no na twita ebe a ndi naeji igbo ede ihe nwayo nwayo ka e ji aracha ofe di oku,1
iwo ranti gbogbo aseyori o da o si tebi tarainu mi dun wipe oku ko ni mo fi ate ranse yii si iwo ore mi,3
ututu oma nwanne dalu,1
lol wetin be your own na by the way e check dm yin sir,2
ire in oju owo n ri ire ni yoo je tiwa loni amin,3
oríì mi bá mi ṣe tèmi níre oríì mi gbére kò mí ire owó ajé ògúngúnnìsọ̀ níná lowó orí jẹ́ kí n rówó ná orí máà jẹ́ ntáwọ́ na ojú owó kì í pọ́n dàda a kì í bá kíkan nínú ìrèké ìkorò kò ní wọ ayéè mi láé ibi ayọ̀ là á bá ọtí ìbànújẹ́ di àfiẹ́yìn láyéè mi àṣẹ,3
but e dey payyy,2
allah ya taimaki malam kuma ya tsare,0
allah ya tabbatar da mafi alkairi,0
imalu mma di egwu,1
‍‍‍chukwuabiama eze ekele diri gi congratulations bro for his mercy said no,1
onye me mma mma imela imela,1
naijiria yìí ti gbogbo wa ni kò mà gbọdọ̀ bàjẹ́ torí kòsí ibòmíràn tí a lè lọ àfi amẹrika àti úróòpù,3
boys dont cry this weekend im so ecstatic,2
kwakwalwanka bairin tamu bache allah ya qara basiraina jin dadin shirin nan,0
ọ bụrụ nọnwụ egbughị amụ ọ ga eririri ife gbara ajị otu ụbọchị ọ bụrụ nọnwụ egbughị ji ejiri chụọ aja ọ ga epuriri ome ụtụtụ ọma nụ ụmụnne mụ,1
ada you sub me nsogbu adiro,1
ólú gbajie girls papa adanna dị sharp,1
big boss oga mmadu,1
allah ya jikan sa da rahama allah yasa aljannah ce makomar sa allah ya jadaddah rahama allah gareshi muma idan tamu tazo allah yasa mu cika da kyau imani albarkacin annabi muhammad saw,0
omo king wasiu ayinde marshal n mura eto igbeyawo tuntun,3
ndi oke uche ‍️,1
thank god for that password wey lasu put for lidc you go just dey cry your cry for house your mama go dey ask wetin happen you go just say you dey meditate na only you know wetin do you,2
odogwu nwoke ekelem gi,1
amin oooo beeni kori ooooo aase wa aase gu nrt e se o bee ni yoo ri fun eyin naa,3
allah sarki wannan mata ba abin matasa zasu ce sai godiya domin ta taimaki gayu,0
thank you sir ️ for made in lagos the album dey gimme joy at least december go get sweet now,2
allahuakbar kullin nafsin zaikatul mauti allah yakawo mana karshen wanna annobar,0
aslm fatima douboun gaisuwa dafatan alhéri dafatan kin wini lfy gaskiya mouna jindadin akuchi da rufi sosai allah ya kara basira sunana hassan,0
lolo akajiaku neme ngala riine pino pino ndi nnewi nwata bu guava full option and a special specculus my bride price has increased laidis just negodu gods creation choi chukwu eke ka,1
lol na that hairstyle i get for head take talk with my ex on the very first day memories,2
aameenallah y kara fasaha mai gd,0
wow well e get as e dey sweet everybody,2
nje e mo wipe orisirisi ede bi ogorun meta ni awon eniyan nso ni ilu london a nse ajodun ede abinibi ni orile ede gbogbo,3
happy birthday chukwu gozie gi,1
order pizza e don dey hungry me since,2
baa faraba kuma bazaayiba insha allahu duka labaran karyane allah yabamu tabbataciyar zaman lafiya a kasata nigeria,0
dama ce a gareki na nenan gafarar allah kuma kusamu damar yin kalimatu shahada allah tsaremana imaninmu kuma ya tsarenu daga zafin kishi amin allah ji kanki da sauran muslmai,0
àmójúkúrò ni í mú ẹ̀mí ìfẹ́ gùn willingness to overlook is what makes loving relationships endure no,3
ah the idea is they are also supposed to campaign back home lets go na i go get you cwo uniform claim say you be lolo and womens leader,2
naso he dey one corner dey laugh,2
you know this white folks em fit don create taser for pussy like that we never can tell this one might be one e go jus do dem giz giz,2
wayyo soyyaya tayi mamaya tayi charab ta chapke mini zuciya,0
umu chukwu i triple captained vardy,1
ìwà lẹ̀sìn bí a bá ṣe mọ̀ọ́ hù ni í ṣeé gbeni character is like religion how well one practises it that is how,3
na you act feel part and lolz erigga don smoke i can feel it,2
na real men b this na confirm people wey sabi shoot shot b thispapa god which day i go get this kind liver omoi dy come learn work asap,2
allah katausayamana albarka watanka mai albarka mun tuba ya allah,0
bóo wá ni a ṣe ń dá irun ará inú aàfin mọ̀ a ó sọ̀ yẹ lọ́la ẹ ẹ ọjọ́ ire ire o,3
ire á kárí o,3
coming from a person i know is extra brilliantnow im scared egbon dat slot still deysebi im your brother too may allah ease for you your affairs,2
agwo nke a amaka,1
imelá ñdéwo nwanne mmadû,1
ní àsìkò àseyorí máse yò láyòju in the time of success dont be overjoyed,3
àgbálùmọ́ dùn ọmọ ọba ló fẹ́ mu ú,3
ní ìdà kejì ayá gbọdọ̀ kẹ́ ọkọ rẹ̀ gẹ̀gẹ̀ ó gbọdọ̀ bọ̀wọ̀ fún un gẹ́gẹ́ bíi olórí ilé nítorí ìwúrí ló jẹ́ bí ayá bá mọ̀kẹ́ ọkọ ọkọ ò ní kọ̀ láti máa ṣe ojúṣe rẹ̀ kí ni ká ti pé tìyàwò tí a fún lówó ọbẹ̀ tí kò sebẹ̀ sílẹ̀ dọkọ,3
daalụ onye ọma,1
this one sef dey,2
e no go fit be ben na calm down,2
torí bi iná mọ̀nàmọ́ná bá wà déédé bẹ́ẹ̀ náà ni gbogbo ńkan á lọ́ déédé iṣé á ya ọpọlọ́ a jí,3
‍️shikuma wannan bawa allah yarinyar ta aure shi a dage da tsayuwar dare,0
ndị be ànyi ekene m unu oo unu aputakwara ụra ehh ka izu ọhụrụ a bute anyị ngọzi niile anyị naayo naka olisa bụ uwaoseburuwa ka onye nwe anyị chekwaba ma gọzie aka ọrụ anyị ụlọ ọrụ anyị na ezinaụlọ anyị niile,1
na benin e dey just incase u want to,2
dalụ nwannem eziokwu bụ ndụ,1
apparently hello means ndeewò agam ebido nkene ndi mmadu otua ututu oma,1
nna i kwụru nke oma,1
ole igwe chineke m o igwe mere m amara igwe okaka igwe mere m amara igwe ole ebe ka m ma eligwe ka m ma,1
e go sweet una na ndi ọrụ oyibo,2
happy birthday more life more mullauna don prove us say dose born in november can talk ehhh,2
awa aye lati wa sin oloorun wa,3
ebube dike asim di nara ekele,1
congratulations ezemuo and the latest baby boy grandpa hope mother and baby is doing well kpom kpom ndi be anyi anyi nwere nzuko onye nu ya gwa ibe ya umuadas mgbako na oge ahour iri taa organize the town crier,1
ẹṣeun ó ti yé wa ọ̀rọ̀ pàtàkì lẹ sọ ọlọ́run ọba ò ní padà lẹ́hìn yín o,3
abeg i don off and on twitter for data becos of this likes dey kill me i dey play for my crush birthday jesus,2
may allah grant you whatever your beautiful heart desires allah ya yafe miki damu baki daya,0
onyeoma yagazie nmaji kwuru nmaji ka jehovah has eji duo gi ulo,1
lol uche m dị ya,1
happy fathers day odogwuabi ofuro ndi mmadu o gbuo ndi mmuo,1
wallahi ban gane ta ba sai da ya yi magana allah ya kara kaifin basira oga director,0
r e d im still taking orders o edakun come and buy cloth o its and it can be customized to your preference it comes in sizes uk if you dont buy i no go get money to chop o please send,2
aiy sun kasheshi aiy allah ya bada saa broda,0
chukwu agizigo gi ontop with,1
ogonogo ndu na aru isike okwa ya kaanyi na ayo,1
umu men na agba mbo ofuma agbacha mbo eri aku udo,1
honest to god im still a learner e dey shook me,2
nwokem mmadu igadi kwa thank you,1
ko ba emi na gbe oooo amin,3
ọmọ naija ẹ yéé bára yín jà ẹ máa bára yín jẹun,3
pla follow back saboda makiya sunci bakisan inayiba more success my best actress,0
hmmmm he don tey wey u don dey rob back abi congratulations man,2
happy new year ndi nkem ️,1
allah ya kyauta ‍️,0
àlááfíà wa ò ní di fíafìa ẹní bá gbọ́n ì bá ṣàmí è mí ṣe áámí,3
ekele ya na nke ómere ó mekwa ózó omeiheoma,1
ọlọ́run nìkan ní íyọni nínú ewu ojú ọ̀nà jàmbá ojú ọ̀nà á jìnà sí gbogbowa o,3
subhanallah har kana ma da bakin magana allahu swt yaqara gyara zuciyoyin mu albarkar manzon shi sallallahu alaihi wasallam,0
omo sense dey here i don talk my own,2
jesus omekanaya i worship you today nara ekele ji bia onye ndi nso,1
nwanyi oma obi ruru mu ala agam eche ka isim batawa,1
ihe di mma rie m ego,1
na the sars we know e don get sense,2
èmi omo olálòjé òjé npetu omo sàkìtì wón wón laso ògà ń ró omo arótí wè bí òjò,3
nothing wey fit happen this year wey dem never see before,2
oya make una come read this thread and tell me wetin think na adult education i go abeg i need guidance thank you in advance,2
amen ozo day at brila fm ozoemena chukwu,1
na soup wey sweet people dey rush u dont have to serve the soup early too,2
nwoke oma i di egwu,1
kuma dei to allah y kiyaye gaba,0
munana tare sarkiallah y aiko d baban rabo,0
bi olopa ba mu e o ni ètó láti mo ìdí ti won fi mu e tàbí èsè re ni warensesa,3
congrats nwoke ọma,1
ṅụọ nu coffee o ga e nyere gị aka na oyi a na tu gị,1
and na for your lower lips i wan make e dey,2
allah ya amsa domin darajar manzonsa,0
okay him dey stable now him dey on drip and e don dey sleep smoothly,2
